name,purpose
Ramirez Group,Total client-driven artificial intelligence for streamline value-added action-items
Garcia-Reynolds,Total didactic encryption for streamline clicks-and-mortar initiatives
Neal-Kaufman,Up-sized even-keeled intranet for strategize transparent e-business
"Davis, Dunlap and Mitchell",Profound cohesive algorithm for synergize B2B architectures
"Dixon, Nixon and Williams",Future-proofed multi-state frame for re-contextualize holistic convergence
Hall Ltd,Visionary bi-directional info-mediaries for synthesize customized communities
Juarez-Hernandez,Operative real-time Internet solution for engage impactful info-mediaries
Nelson Ltd,Optimized foreground open architecture for implement robust info-mediaries
Henderson and Sons,Integrated 5thgeneration hub for synthesize web-enabled content
Caldwell-Baldwin,Universal even-keeled framework for iterate impactful ROI
Sanders Ltd,Configurable asynchronous functionalities for strategize extensible networks
Jones Inc,Realigned interactive frame for redefine B2C metrics
"Bauer, Williamson and Padilla",Versatile discrete project for envisioneer intuitive platforms
"Peterson, Alvarez and Lee",Fully-configurable mobile strategy for productize viral architectures
"Scott, Deleon and Bennett",Devolved leadingedge system engine for re-contextualize global vortals
Woods-Smith,Ameliorated global structure for scale e-business platforms
Castaneda PLC,Cloned system-worthy time-frame for incubate bricks-and-clicks e-services
White Ltd,Grass-roots explicit secured line for monetize cross-platform content
Li and Sons,Persevering directional encoding for brand e-business ROI
Ashley PLC,Compatible intangible hierarchy for evolve distributed e-markets
Luna-Jackson,Focused reciprocal model for reinvent bleeding-edge supply-chains
"Stewart, Garcia and Arnold",Fully-configurable grid-enabled groupware for synthesize global systems
Jones Ltd,De-engineered multi-state projection for enable integrated functionalities
Mccoy and Sons,Grass-roots empowering capacity for synthesize intuitive functionalities
"Allen, Parker and Sullivan",Assimilated multi-state structure for integrate global functionalities
Holmes-Torres,Self-enabling disintermediate product for repurpose scalable methodologies
"Villanueva, Massey and Allen",Right-sized contextually-based conglomeration for strategize real-time experiences
Norris-Harrison,User-centric context-sensitive website for innovate visionary deliverables
"Lewis, Newton and Sanders",Digitized fault-tolerant paradigm for enhance cutting-edge eyeballs
"Price, Jackson and Clark",Intuitive zero-defect installation for extend plug-and-play supply-chains
"Lee, Friedman and Keith",Organic context-sensitive core for productize magnetic synergies
"Harrison, Davis and Sims",Customer-focused regional intranet for facilitate granular e-business
Patterson-Fox,Right-sized reciprocal protocol for incentivize sticky partnerships
Chavez Group,Balanced stable algorithm for disintermediate clicks-and-mortar relationships
"Taylor, Riley and Williams",Organic holistic forecast for re-intermediate revolutionary initiatives
"Griffin, Anderson and Moody",Visionary zero tolerance flexibility for envisioneer dot-com supply-chains
"Johnson, Zamora and Miller",Synchronized clear-thinking productivity for syndicate back-end info-mediaries
Lee-Owens,Profit-focused grid-enabled process improvement for incentivize world-class solutions
Meyer PLC,Face-to-face impactful contingency for innovate front-end eyeballs
Molina Group,Decentralized background process improvement for monetize enterprise platforms
"Davis, Carr and Watkins",Stand-alone incremental system engine for generate 24/7 vortals
"Morris, Barker and Lawrence",Persistent disintermediate throughput for brand ubiquitous portals
"Martinez, Sanford and Fernandez",Assimilated responsive concept for morph plug-and-play supply-chains
Keller Group,Fundamental hybrid portal for strategize synergistic paradigms
Howard-Morrison,Diverse empowering info-mediaries for brand extensible platforms
Horton LLC,Innovative real-time orchestration for architect interactive applications
Ware-Holmes,Exclusive neutral migration for re-contextualize world-class convergence
"Martin, Arnold and Oconnell",Object-based object-oriented secured line for empower clicks-and-mortar interfaces
"Jimenez, Johnson and Fleming",Business-focused bandwidth-monitored structure for re-contextualize one-to-one methodologies
Wilcox-Robertson,Reduced disintermediate array for transition magnetic metrics
